{
  "$schema": "http://json-schema.org/draft-07/schema#",
  "$id": "parley/scenario.schema.json",
  "title": "Scenario card",
  "type": "object",
  "required": ["id", "title", "type", "date", "setting", "stakes"],
  "additionalProperties": false,
  "properties": {
    "id": { "type": "string", "pattern": "^[a-z0-9-]+$" },
    "title": { "type": "string", "minLength": 3 },
    "type": { "enum": ["historical", "hypothetical", "custom"] },
    "date": {
      "type": "string",
      "pattern": "^-?[0-9]{1,4}-[0-9]{2}-[0-9]{2}$",
      "description": "ISO date of the scene. Negative leading year = BCE."
    },
    "date_label": {
      "type": "string",
      "description": "How the date should be spoken in prose, e.g. '28 November 1943'."
    },
    "setting": { "type": "string", "minLength": 20 },
    "participants_hint": { "type": "array", "items": { "type": "string" } },
    "min_cast": { "type": "integer", "minimum": 2 },
    "max_cast": { "type": "integer", "maximum": 6 },
    "stakes": { "type": "string", "minLength": 10 },
    "issue_tags": {
      "type": "array",
      "items": { "type": "string" },
      "description": "Matched against character `positions` keys to surface relevant stances."
    },
    "roles_in_scene": {
      "type": "object",
      "description": "Per-character-id role line. Falls back to a generic line.",
      "additionalProperties": { "type": "string" }
    },
    "ground_truth": {
      "type": "array",
      "items": { "type": "string" },
      "description": "Beats the director may inject, in rough order. Empty for hypothetical/custom."
    },
    "opening_line": {
      "type": "string",
      "description": "Narrator text shown before the first turn."
    },
    "sources": { "type": "array", "items": { "type": "string" } }
  }
}
